{"capability":"iroh-relay-capability-v1","evidence_summary":{"arms":[{"captured_direct_peer_packets":0,"captured_packets":134,"captured_pcap_records":134,"captured_relay_packets":124,"connect_ms":3030,"connection_path":"relayed","dropped_by_kernel":0,"elapsed_ms":4096,"received_by_filter":134,"relay_attributed":true,"scenario":"relay-success","verdict":"connected"},{"captured_direct_peer_packets":33,"captured_packets":35,"captured_pcap_records":35,"captured_relay_packets":0,"connect_ms":1,"connection_path":"direct","dropped_by_kernel":0,"elapsed_ms":1152,"received_by_filter":35,"relay_attributed":false,"scenario":"direct-positive","verdict":"connected"},{"captured_direct_peer_packets":0,"captured_packets":34,"captured_pcap_records":34,"captured_relay_packets":0,"connect_ms":10000,"dropped_by_kernel":0,"elapsed_ms":13100,"reason":"deadline","received_by_filter":34,"relay_attributed":false,"scenario":"relay-outage","verdict":"unavailable"},{"captured_direct_peer_packets":0,"captured_packets":0,"captured_pcap_records":0,"captured_relay_packets":0,"dropped_by_kernel":0,"elapsed_ms":85,"reason":"wrong_relay_url","received_by_filter":0,"relay_attributed":false,"scenario":"wrong-url","verdict":"unavailable"},{"captured_direct_peer_packets":0,"captured_packets":153,"captured_pcap_records":153,"captured_relay_packets":143,"connect_ms":10000,"dropped_by_kernel":0,"elapsed_ms":13151,"reason":"deadline","received_by_filter":153,"relay_attributed":false,"scenario":"wrong-certificate","verdict":"unavailable"},{"captured_direct_peer_packets":0,"captured_packets":98,"captured_pcap_records":98,"captured_relay_packets":88,"connect_ms":10000,"dropped_by_kernel":0,"elapsed_ms":13103,"reason":"deadline","received_by_filter":98,"relay_attributed":false,"scenario":"wrong-identity","verdict":"unavailable"},{"captured_direct_peer_packets":0,"captured_packets":123,"captured_pcap_records":123,"captured_relay_packets":113,"connect_ms":3032,"dropped_by_kernel":0,"elapsed_ms":4125,"reason":"half_open_stream","received_by_filter":123,"relay_attributed":false,"scenario":"half-open-stream","verdict":"unavailable"},{"captured_direct_peer_packets":0,"captured_packets":85,"captured_pcap_records":85,"captured_relay_packets":75,"connect_ms":10000,"dropped_by_kernel":0,"elapsed_ms":13096,"reason":"deadline","received_by_filter":85,"relay_attributed":false,"scenario":"forced-direct-failure","verdict":"unavailable"}],"boundaries":{"direct_positive_not_credited":true,"no_discovery":true,"no_public_relay":true,"no_publication":true,"relay_only_when_direct_blocked":true},"capture":{"filter":"tcp or udp","interface":"any","scope":"all-tcp-udp-in-peer-netns-v1"},"deadline_ms":10000,"grace_ms":1000,"limitations":[{"description":"Relay attribution holds for the L3-blocked routed topology in this evidence. iroh may upgrade a relayed path to a direct one after hole-punching; the block is what makes 'the relay carried it' unfalsifiable here, not the classifier reading alone.","id":"relay-attribution-scope"},{"description":"The relay is a locally operated, self-signed relay reached over a routed private network. This is production-shaped, not a public Internet / NAT-traversal proof; no n0/public relay is contacted.","id":"production-shaped-local-only"},{"description":"Some adverse arms (relay outage, wrong identity) may surface as a bounded 'deadline' rather than a finer typed reason: the peer reports only what iroh's connect observes. Causal attribution is the harness topology and packet capture, not the peer self-report.","id":"typed-failure-causal-attribution"},{"description":"Packet attribution is IPv4-only over IPv4-only internal podman networks; the finalizer requires every captured record to decode to an IPv4 TCP/UDP flow (records == IPv4-flow count), so a non-IPv4 path cannot silently escape the zero-direct guard. The attribution coordinates (relay_ip/acceptor_ip) are re-derived from the canonical acceptor subnet offsets, not trusted from run.json.","id":"ipv4-only-attribution"},{"description":"connect_ms is a peer self-report bounded by the peer's own 10000 ms connect timeout; the finalizer's 11000 ms gate re-asserts the deadline (no longer clamps it) rather than measuring latency independently. Its anchor is the git-blob-pinned peer binary.","id":"connect-ms-peer-self-report"}],"profile":"production-shaped-local","raw_schema":"iroh-relay-capability-evidence-v1","relay":{"authorization_class":"production-shaped-local","external_contact_authorized":false,"kind":"local-routed-iroh-relay","owner":"nix-p2p-task142-evidence","relay_url":"https://10.211.52.40:44380"},"run_id":"r86596355","topology":{"acceptor_ip":"10.211.52.10","acceptor_network":"nix-p2p-task142-r86596355-acceptor-net","acceptor_subnet":"10.211.52.0/24","connector_network":"nix-p2p-task142-r86596355-connector-net","connector_subnet":"10.213.53.0/24","relay_ip":"10.211.52.40","run_id":"r86596355"}},"failed_constraints":[],"implementation":{"commit":"76ae1e78605da29905a1f230cc168a4fc7364193","files":[{"bytes":157369,"git_blob":"0d7aa096db5e7aedcd0c5528f83de7fbe31fd9ec","path":"Cargo.lock","sha256":"95a8d4a860fe08cf1086e9e62abaca737ab9a467e06a6179ea2ac10a84ed6cce"},{"bytes":21353,"git_blob":"592b05ce0646653f1e56b951d0210be6279d3724","path":"Justfile","sha256":"c22c121f6895b0af224a9db2dd8a0a8585557ff798d38882b8eb1e697a7d1fe3"},{"bytes":22133,"git_blob":"5e9af8b8d6007ff70312773f038ff52b2db150fd","path":"flake.nix","sha256":"bd7a6764e73ab7b1e40511b0ae7a778772c9f41546a9f6d0e1f0effcc88a3f3c"},{"bytes":13282,"git_blob":"147aaa1cabd85df4384f1201e03671215c93524e","path":"daemon/Cargo.toml","sha256":"ed1356925e51937112d803ed183e7c75a26c1f8a08d959baa387ef240f3bafcb"},{"bytes":33951,"git_blob":"df1f0507ba0f743174dc0b938343f257683e0178","path":"fabric-iroh/src/iroh_relay.rs","sha256":"364a9c446679495ef6e602ad68446c7c91626a38c669ab74f7cd0918fa8a2209"},{"bytes":13202,"git_blob":"f1b23a992906766992e193d6ec824b7c22e29752","path":"daemon/src/bin/iroh_relay_evidence_server.rs","sha256":"a0b8f2fff64c468c68aba21e5f2ac9ac15f2ba7975eb2ad4279c524741544f34"},{"bytes":30214,"git_blob":"ed3dd506fcf2a05ee2a09e2697d22d59ef6047bf","path":"daemon/src/bin/iroh_relay_evidence_peer.rs","sha256":"0e72b93cb2fc75b13969adcf4e1933f78369134290190be54d5472be8dcfeb9b"},{"bytes":9998,"git_blob":"67118dce6801cb43a8d5204a7b541beb723a9fb3","path":"docs/iroh-relay-capability-artifact-v1.schema.json","sha256":"f188af582dc9ee61bcca96f4e826c0426ec0e2fb031b1aba1caea7a7a57ed197"},{"bytes":7411,"git_blob":"5b71e0fa203d89693d727b17e6c485b83f737bef","path":"docs/iroh-relay-capability-v1.md","sha256":"60f163d47a5de5e5c4b6b141af21f2c4f1cca4010578cdbedbd83fbfb7edbb78"},{"bytes":43019,"git_blob":"cd4300b7df44db3a961a2f615ac1d2f80c8572c3","path":"scripts/iroh_relay_capability_evidence.py","sha256":"1dbd5649ce61ac4d73746ddc40bcb66659fd8f0cf07f8b7a1de29ccee6956b32"},{"bytes":42322,"git_blob":"f327b39f791d97d077bf26fd6c0954245b346353","path":"scripts/finalize_iroh_relay_capability.py","sha256":"bc64d6c6d24e98126af2f1d5c9b3b04e9ad9c326c6935d89c7233c5aa2390d76"}],"git_object_format":"sha1","tree":"5361cf382003e9e9a9c408682a0f1517658d9a41"},"raw_evidence":{"file_count":17,"files":[{"bytes":295,"path":"direct-positive.capture.log","sha256":"f616e784d27280c060e50e4c9911bf53773447cdddc79ca8f1df1368a2f5ea36"},{"bytes":26443,"path":"direct-positive.pcap","sha256":"430c2f774c02028fe1dd3513967bf4243f3371d742fff43ff2b6eb45820e584c"},{"bytes":295,"path":"forced-direct-failure.capture.log","sha256":"bf1693d812784979ec72ebe9796d52826acde34faf1896892558c36684584185"},{"bytes":23308,"path":"forced-direct-failure.pcap","sha256":"d91bd4e9d67586791f29cae82e85c848d4e44199d3a30f0d4abe5719da6f9fff"},{"bytes":297,"path":"half-open-stream.capture.log","sha256":"2c8d8b3d6af254ec556aaa591090995b5b74d23d584cc57461c68418150b9e8f"},{"bytes":42457,"path":"half-open-stream.pcap","sha256":"5bba5f987e6ebe67d6ee84d20aaf089195cd0e0fa56e34cab04508111aaa47d7"},{"bytes":295,"path":"relay-outage.capture.log","sha256":"f4b56c9826b48ed2b9a2e2b84ccb7d289776408c03f16a2e25d61085db3e047b"},{"bytes":12632,"path":"relay-outage.pcap","sha256":"9626deb05d69825fbdee88e6eced839238b6938d0e84f7c97e3e8253be1f2a03"},{"bytes":297,"path":"relay-success.capture.log","sha256":"decd9158367ae6067692858b94cadd951c1729d9bf6f657ac3924ee59d4c5033"},{"bytes":45203,"path":"relay-success.pcap","sha256":"13909708873d965a67edcb9755024c18631d45f84347afa7a886abb0e9360bdb"},{"bytes":3075,"path":"run.json","sha256":"5c4e98cf0b6dc63c69145ff57c0ae082462374bc095268fa250727fb72e929fc"},{"bytes":297,"path":"wrong-certificate.capture.log","sha256":"243e5bc0ff87173be51001b702a4d729c8cf72ae2765fb4167231523a1010247"},{"bytes":35194,"path":"wrong-certificate.pcap","sha256":"fa44fb4f4e1188667cea0c407ce642d88a44a56396a405f0dc96b30ab137e6a2"},{"bytes":295,"path":"wrong-identity.capture.log","sha256":"3c8e5db3f8f16268180842c52c41f86d7a33c98a8d007040310151a60d38ec48"},{"bytes":34564,"path":"wrong-identity.pcap","sha256":"f14abfcb5b07c88a414b6f80f8be96cc08ccc4f774cd59b6c439116ba2ef8ac9"},{"bytes":293,"path":"wrong-url.capture.log","sha256":"324b40baae834b43d32916783b75c11a3139b5621fcbad98b7341fd2903ead91"},{"bytes":24,"path":"wrong-url.pcap","sha256":"e3f42e2687636327d7f18c9635173252505b4a838fa6829a755bab06c9c69749"}],"manifest_sha256":"3d77083acc47c149b61a9d7ea13eb0805a4e0b76102bfa2db6bf3cae4622b898","schema":"iroh-relay-capability-raw-evidence-manifest-v1","total_bytes":225264},"schema":"iroh-relay-capability-artifact-v1","verdict":"pass"}
